Aspect,Details
Archetype,The Hermit
Title,She Who Watches the Web and Weaves in Silence
Core Meaning,"Contemplation, solitude, sacred pause, seeing through the unseen, weaving one’s own truth in the quiet"
Symbolic Traits,"Spider-like solitude, reflective stillness, glowing threads of thought, dust and corners, long glances"
Presence,"Appears in moments of retreat, withdrawal, or deep inner processing"
Sigil Description,"White chalk spiral lines forming a spider-like glyph, surrounded by dots like threads in a web"
Notable Symbol,"The Weight — not beneath, but *before* her — a symbol to be acknowledged, not carried"
Special Element,Ritual of Seeing — she never passes the weight without bowing her awareness to it
